<?xml version="1.0" encoding="ISO-8859-1"?>
<!DOCTYPE partitioner_configuration SYSTEM "partitioner_configuration.dtd">
<partitioner_configuration>
  <general_configuration>
    <device_resource>
      <resource_id>0</resource_id>
      <resource_capacity>50000</resource_capacity>
      <max_imbalance>0.05</max_imbalance>
    </device_resource>
    <device_resource>
      <resource_id>1</resource_id>
      <resource_capacity>20000</resource_capacity>
      <max_imbalance>0.05</max_imbalance>
    </device_resource>
    <device_resource>
      <resource_id>2</resource_id>
      <resource_capacity>10000</resource_capacity>
      <max_imbalance>0.05</max_imbalance>
    </device_resource>
  </general_configuration>
  <preprocessor_configuration>
    <!--
    <all_universal_resource_strategy>
      <universal_resource_id>0</universal_resource_id>
    </all_universal_resource_strategy>
    -->
    <!--
    <proportional_to_capacity_strategy>
      <use_flexible_capacity/>
    </proportional_to_capacity_strategy>
    -->
    <random_strategy>
    </random_strategy>
  </preprocessor_configuration>
  <klfm_configuration>
    <gain_bucket_type>
      <!--
      <single_resource_bucket/>
      -->
      <!--
      <multi_resource_exclusive_bucket>
        <use_adaptive_implementations/>
        <use_random_resource_selection_policy/>
        <use_largest_resource_imbalance_selection_policy/>
        <use_largest_unconstrained_gain_selection_policy/>
        <use_largest_gain_selection_policy/>
      </multi_resource_exclusive_bucket>
      -->
      <multi_resource_mixed_bucket>
        <use_adaptive_implementations/>
      <!--
        <use_random_resource_selection_policy/>
        <use_most_unbalanced_resource_selection_policy/>
      -->
        <use_best_gain_imbalance_score_classic_selection_policy/>
      <!--
        <use_best_gain_imbalance_score_with_affinities_selection_policy/>
      -->
      </multi_resource_mixed_bucket>
    </gain_bucket_type>
    <node_implementation_options>
      <!--
      <restrict_supernodes_to_default_implementation/>
      -->
      <supernode_implementations_cap>16</supernode_implementations_cap>
      <!--
      <reuse_previous_run_implementations/>
      -->
      <mutation_options>
        <mutation_rate>0</mutation_rate>
      </mutation_options>
      <rebalance_options>
        <rebalance_on_demand>
          <rebalance_on_demand_cap_per_run>20</rebalance_on_demand_cap_per_run>
          <rebalance_on_demand_cap_per_pass>1</rebalance_on_demand_cap_per_pass>
        </rebalance_on_demand>
      </rebalance_options>
    </node_implementation_options>
  </klfm_configuration>
</partitioner_configuration>
